{
  "$schema": "https://json-schema.org/draft/2020-12/schema",
  "title": "MindReply Playbook",
  "type": "object",
  "required": ["playbook_id", "title", "description", "version", "triggers", "decision_tree", "actions", "verification", "audit"],
  "properties": {
    "playbook_id": { "type": "string", "minLength": 1 },
    "title": { "type": "string", "minLength": 1 },
    "description": { "type": "string", "minLength": 1 },
    "version": { "type": "string", "pattern": "^[0-9]+\\.[0-9]+$" },
    "triggers": {
      "type": "array",
      "items": {
        "type": "object",
        "required": ["type", "pattern"],
        "properties": {
          "type": { "enum": ["email", "calendar", "file", "webhook", "manual"] },
          "pattern": { "type": "string", "minLength": 1 }
        }
      }
    },
    "decision_tree": {
      "type": "object",
      "required": ["nodes"],
      "properties": {
        "nodes": {
          "type": "array",
          "items": {
            "type": "object",
            "required": ["id", "condition", "action", "next"],
            "properties": {
              "id": { "type": "string" },
              "condition": { "type": "string" },
              "action": { "enum": ["reply", "schedule", "resolve", "escalate"] },
              "next": { "type": "array", "items": { "type": "string" } }
            }
          }
        }
      }
    },
    "actions": {
      "type": "array",
      "items": {
        "type": "object",
        "required": ["id", "type", "template_id", "params"],
        "properties": {
          "id": { "type": "string" },
          "type": { "enum": ["email_template", "api_call", "task_create", "calendar_event", "noop"] },
          "template_id": { "type": "string" },
          "params": { "type": "object" }
        }
      }
    },
    "verification": {
      "type": "object",
      "required": ["required", "roles"],
      "properties": {
        "required": { "type": "boolean" },
        "roles": { "type": "array", "items": { "type": "string" } }
      }
    },
    "audit": {
      "type": "object",
      "required": ["exportable", "signed"],
      "properties": {
        "exportable": { "type": "boolean" },
        "signed": { "type": "boolean" }
      }
    }
  }
}
